<xs:schema xmlns:xs="http://www.w3.org/2001/XMLSchema">
    <xs:element name="szemelyek">
        <xs:complexType>
            <xs:sequence>
                <xs:element name="szemely" maxOccurs="unbounded">
                    <xs:complexType>
                        <xs:sequence>
                            <xs:element name="nev" type="xs:string"/>
                            <xs:element name="kor" type="xs:string"/>
                            <xs:element name="varos" type="xs:string"/>
                        </xs:sequence>
                        <xs:attribute name="id" type="xs:string" use="required"/>
                    </xs:complexType>
                </xs:element>
            </xs:sequence>
        </xs:complexType>
        
    </xs:element>
</xs:schema>